{
  "dataset": "japan-regional-minimum-wage",
  "fiscalYear": "R8",
  "year": 2026,
  "unit": "JPY/hour",
  "updatedAt": "2026-10-22",
  "sources": {
    "nationalList": "https://www.mhlw.go.jp/stf/seisakunitsuite/bunya/koyou_roudou/roudoukijun/minimumichiran/",
    "datasetPage": "https://jikyulab.com/saitei-chingin"
  },
  "summary": {
    "nationalWeightedAverage": 1177,
    "nationalWeightedAveragePrevious": 1121,
    "highest": { "prefecture": "東京都", "slug": "tokyo", "amount": 1280 },
    "lowest":  { "prefecture": "宮崎県", "slug": "miyazaki", "amount": 1085 },
    "spread": 195,
    "appliedCount": 32,
    "notYetEffectiveCount": 15
  },
  "note": "applied は 2026-10-22 時点で発効日を迎えているかどうか。dateTentative が true の県は発効日がまだ「予定」。金額・発効日は各都道府県労働局の公示で必ず確認すること（本データの根拠：https://jikyulab.com/saitei-chingin 最終確認日 2026-10-07）。",
  "prefectures": [
    { "code": "01", "name": "北海道",   "slug": "hokkaido",  "region": "hokkaido-tohoku", "amountR8": 1131, "amountR7": 1075, "diff": 56, "effectiveDate": "2026-10-01", "dateTentative": false, "applied": true  },
    { "code": "02", "name": "青森県",   "slug": "aomori",    "region": "hokkaido-tohoku", "amountR8": 1090, "amountR7": 1029, "diff": 61, "effectiveDate": "2026-10-29", "dateTentative": true,  "applied": false },
    { "code": "03", "name": "岩手県",   "slug": "iwate",     "region": "hokkaido-tohoku", "amountR8": 1090, "amountR7": 1031, "diff": 59, "effectiveDate": "2026-12-01", "dateTentative": true,  "applied": false },
    { "code": "04", "name": "宮城県",   "slug": "miyagi",    "region": "hokkaido-tohoku", "amountR8": 1098, "amountR7": 1038, "diff": 60, "effectiveDate": "2026-10-01", "dateTentative": false, "applied": true  },
    { "code": "05", "name": "秋田県",   "slug": "akita",     "region": "hokkaido-tohoku", "amountR8": 1090, "amountR7": 1031, "diff": 59, "effectiveDate": "2026-10-14", "dateTentative": false, "applied": true  },
    { "code": "06", "name": "山形県",   "slug": "yamagata",  "region": "hokkaido-tohoku", "amountR8": 1092, "amountR7": 1032, "diff": 60, "effectiveDate": "2026-10-30", "dateTentative": true,  "applied": false },
    { "code": "07", "name": "福島県",   "slug": "fukushima", "region": "hokkaido-tohoku", "amountR8": 1094, "amountR7": 1033, "diff": 61, "effectiveDate": "2026-10-16", "dateTentative": false, "applied": true  },
    { "code": "08", "name": "茨城県",   "slug": "ibaraki",   "region": "kanto", "amountR8": 1136, "amountR7": 1074, "diff": 62, "effectiveDate": "2026-10-18", "dateTentative": false, "applied": true  },
    { "code": "09", "name": "栃木県",   "slug": "tochigi",   "region": "kanto", "amountR8": 1125, "amountR7": 1068, "diff": 57, "effectiveDate": "2026-10-01", "dateTentative": false, "applied": true  },
    { "code": "10", "name": "群馬県",   "slug": "gunma",     "region": "kanto", "amountR8": 1120, "amountR7": 1063, "diff": 57, "effectiveDate": "2026-10-03", "dateTentative": false, "applied": true  },
    { "code": "11", "name": "埼玉県",   "slug": "saitama",   "region": "kanto", "amountR8": 1196, "amountR7": 1141, "diff": 55, "effectiveDate": "2026-10-01", "dateTentative": false, "applied": true  },
    { "code": "12", "name": "千葉県",   "slug": "chiba",     "region": "kanto", "amountR8": 1195, "amountR7": 1140, "diff": 55, "effectiveDate": "2026-10-01", "dateTentative": false, "applied": true  },
    { "code": "13", "name": "東京都",   "slug": "tokyo",     "region": "kanto", "amountR8": 1280, "amountR7": 1226, "diff": 54, "effectiveDate": "2026-10-01", "dateTentative": false, "applied": true  },
    { "code": "14", "name": "神奈川県", "slug": "kanagawa",  "region": "kanto", "amountR8": 1279, "amountR7": 1225, "diff": 54, "effectiveDate": "2026-10-01", "dateTentative": false, "applied": true  },
    { "code": "15", "name": "新潟県",   "slug": "niigata",   "region": "chubu", "amountR8": 1108, "amountR7": 1050, "diff": 58, "effectiveDate": "2026-10-01", "dateTentative": false, "applied": true  },
    { "code": "16", "name": "富山県",   "slug": "toyama",    "region": "chubu", "amountR8": 1119, "amountR7": 1062, "diff": 57, "effectiveDate": "2026-10-01", "dateTentative": false, "applied": true  },
    { "code": "17", "name": "石川県",   "slug": "ishikawa",  "region": "chubu", "amountR8": 1113, "amountR7": 1054, "diff": 59, "effectiveDate": "2026-10-03", "dateTentative": false, "applied": true  },
    { "code": "18", "name": "福井県",   "slug": "fukui",     "region": "chubu", "amountR8": 1112, "amountR7": 1053, "diff": 59, "effectiveDate": "2026-10-04", "dateTentative": false, "applied": true  },
    { "code": "19", "name": "山梨県",   "slug": "yamanashi", "region": "chubu", "amountR8": 1113, "amountR7": 1052, "diff": 61, "effectiveDate": "2026-11-01", "dateTentative": false, "applied": false },
    { "code": "20", "name": "長野県",   "slug": "nagano",    "region": "chubu", "amountR8": 1117, "amountR7": 1061, "diff": 56, "effectiveDate": "2026-10-02", "dateTentative": false, "applied": true  },
    { "code": "21", "name": "岐阜県",   "slug": "gifu",      "region": "chubu", "amountR8": 1121, "amountR7": 1065, "diff": 56, "effectiveDate": "2026-10-01", "dateTentative": false, "applied": true  },
    { "code": "22", "name": "静岡県",   "slug": "shizuoka",  "region": "chubu", "amountR8": 1154, "amountR7": 1097, "diff": 57, "effectiveDate": "2026-10-15", "dateTentative": false, "applied": true  },
    { "code": "23", "name": "愛知県",   "slug": "aichi",     "region": "chubu", "amountR8": 1195, "amountR7": 1140, "diff": 55, "effectiveDate": "2026-10-01", "dateTentative": false, "applied": true  },
    { "code": "24", "name": "三重県",   "slug": "mie",       "region": "kinki", "amountR8": 1143, "amountR7": 1087, "diff": 56, "effectiveDate": "2026-10-01", "dateTentative": false, "applied": true  },
    { "code": "25", "name": "滋賀県",   "slug": "shiga",     "region": "kinki", "amountR8": 1136, "amountR7": 1080, "diff": 56, "effectiveDate": "2026-10-03", "dateTentative": false, "applied": true  },
    { "code": "26", "name": "京都府",   "slug": "kyoto",     "region": "kinki", "amountR8": 1180, "amountR7": 1122, "diff": 58, "effectiveDate": "2026-11-16", "dateTentative": false, "applied": false },
    { "code": "27", "name": "大阪府",   "slug": "osaka",     "region": "kinki", "amountR8": 1231, "amountR7": 1177, "diff": 54, "effectiveDate": "2026-10-01", "dateTentative": false, "applied": true  },
    { "code": "28", "name": "兵庫県",   "slug": "hyogo",     "region": "kinki", "amountR8": 1172, "amountR7": 1116, "diff": 56, "effectiveDate": "2026-10-01", "dateTentative": false, "applied": true  },
    { "code": "29", "name": "奈良県",   "slug": "nara",      "region": "kinki", "amountR8": 1107, "amountR7": 1051, "diff": 56, "effectiveDate": "2026-10-04", "dateTentative": false, "applied": true  },
    { "code": "30", "name": "和歌山県", "slug": "wakayama",  "region": "kinki", "amountR8": 1101, "amountR7": 1045, "diff": 56, "effectiveDate": "2026-10-03", "dateTentative": false, "applied": true  },
    { "code": "31", "name": "鳥取県",   "slug": "tottori",   "region": "chugoku", "amountR8": 1090, "amountR7": 1030, "diff": 60, "effectiveDate": "2026-10-03", "dateTentative": false, "applied": true  },
    { "code": "32", "name": "島根県",   "slug": "shimane",   "region": "chugoku", "amountR8": 1092, "amountR7": 1033, "diff": 59, "effectiveDate": "2026-10-10", "dateTentative": false, "applied": true  },
    { "code": "33", "name": "岡山県",   "slug": "okayama",   "region": "chugoku", "amountR8": 1104, "amountR7": 1047, "diff": 57, "effectiveDate": "2026-10-02", "dateTentative": false, "applied": true  },
    { "code": "34", "name": "広島県",   "slug": "hiroshima", "region": "chugoku", "amountR8": 1141, "amountR7": 1085, "diff": 56, "effectiveDate": "2026-10-11", "dateTentative": false, "applied": true  },
    { "code": "35", "name": "山口県",   "slug": "yamaguchi", "region": "chugoku", "amountR8": 1101, "amountR7": 1043, "diff": 58, "effectiveDate": "2026-10-08", "dateTentative": false, "applied": true  },
    { "code": "36", "name": "徳島県",   "slug": "tokushima", "region": "shikoku", "amountR8": 1103, "amountR7": 1046, "diff": 57, "effectiveDate": "2026-11-01", "dateTentative": false, "applied": false },
    { "code": "37", "name": "香川県",   "slug": "kagawa",    "region": "shikoku", "amountR8": 1092, "amountR7": 1036, "diff": 56, "effectiveDate": "2026-10-01", "dateTentative": false, "applied": true  },
    { "code": "38", "name": "愛媛県",   "slug": "ehime",     "region": "shikoku", "amountR8": 1093, "amountR7": 1033, "diff": 60, "effectiveDate": "2026-11-01", "dateTentative": false, "applied": false },
    { "code": "39", "name": "高知県",   "slug": "kochi",     "region": "shikoku", "amountR8": 1086, "amountR7": 1023, "diff": 63, "effectiveDate": "2026-10-29", "dateTentative": false, "applied": false },
    { "code": "40", "name": "福岡県",   "slug": "fukuoka",   "region": "kyushu-okinawa", "amountR8": 1114, "amountR7": 1057, "diff": 57, "effectiveDate": "2026-10-04", "dateTentative": false, "applied": true  },
    { "code": "41", "name": "佐賀県",   "slug": "saga",      "region": "kyushu-okinawa", "amountR8": 1095, "amountR7": 1030, "diff": 65, "effectiveDate": "2026-11-15", "dateTentative": false, "applied": false },
    { "code": "42", "name": "長崎県",   "slug": "nagasaki",  "region": "kyushu-okinawa", "amountR8": 1087, "amountR7": 1031, "diff": 56, "effectiveDate": "2026-11-02", "dateTentative": true,  "applied": false },
    { "code": "43", "name": "熊本県",   "slug": "kumamoto",  "region": "kyushu-okinawa", "amountR8": 1092, "amountR7": 1034, "diff": 58, "effectiveDate": "2026-12-01", "dateTentative": true,  "applied": false },
    { "code": "44", "name": "大分県",   "slug": "oita",      "region": "kyushu-okinawa", "amountR8": 1096, "amountR7": 1035, "diff": 61, "effectiveDate": "2026-11-01", "dateTentative": false, "applied": false },
    { "code": "45", "name": "宮崎県",   "slug": "miyazaki",  "region": "kyushu-okinawa", "amountR8": 1085, "amountR7": 1023, "diff": 62, "effectiveDate": "2026-10-24", "dateTentative": true,  "applied": false },